{
  "$schema": "https://json-schema.org/draft/2020-12/schema",
  "type": "object",
  "required": ["id", "date", "weekday", "mock_priority", "liturgical", "calendars", "primary", "sources", "app_hooks"],
  "properties": {
    "id": {"type": "string", "pattern": "^anno-\\d{4}-\\d{2}-\\d{2}$"},
    "date": {"type": "string", "pattern": "^\\d{4}-\\d{2}-\\d{2}$"},
    "weekday": {"type": "string"},
    "mock_priority": {"const": "engine_b_v1"},
    "liturgical": {
      "type": "object",
      "required": ["rank", "color", "title_en", "title_vi"],
      "properties": {
        "rank": {"enum": ["Solemnity", "Feast", "Memorial", "Optional Memorial", "Feria", "Sunday"]},
        "color": {"enum": ["white", "red", "green", "purple", "rose", "gold", "verdigris"]},
        "title_en": {"type": "string", "minLength": 1},
        "title_vi": {"type": "string", "minLength": 1}
      }
    },
    "calendars": {
      "type": "object",
      "required": ["julian", "hebrew", "islamic_umm_al_qura", "coptic", "ethiopian"],
      "properties": {
        "julian": {"type": "string"},
        "hebrew": {"type": "string"},
        "islamic_umm_al_qura": {"type": "string"},
        "coptic": {"type": "string"},
        "ethiopian": {"type": "string"}
      }
    },
    "primary": {
      "type": "object",
      "required": ["type", "title_en", "title_vi", "summary_en", "summary_vi", "body_en", "body_vi", "confidence", "confidence_note_en", "confidence_note_vi"],
      "properties": {
        "type": {"enum": ["saint", "liturgical_day", "historical_event", "feast", "solemnity"]},
        "title_en": {"type": "string", "minLength": 1},
        "title_vi": {"type": "string", "minLength": 1},
        "summary_en": {"type": "string", "minLength": 1},
        "summary_vi": {"type": "string", "minLength": 1},
        "body_en": {"type": "string", "minLength": 1},
        "body_vi": {"type": "string", "minLength": 1},
        "confidence": {"enum": ["confirmed", "traditional", "disputed", "contextual"]},
        "confidence_note_en": {"type": "string", "minLength": 1},
        "confidence_note_vi": {"type": "string", "minLength": 1}
      }
    },
    "place": {
      "type": ["object", "null"],
      "properties": {
        "name": {"type": ["string", "null"]},
        "latitude": {"type": ["number", "null"]},
        "longitude": {"type": ["number", "null"]},
        "confidence": {"enum": ["confirmed", "traditional", "disputed", "contextual"]},
        "source_url": {"type": ["string", "null"], "format": "uri"}
      }
    },
    "artwork": {
      "type": "object",
      "required": ["title", "maker", "date_label", "source_url", "status"],
      "properties": {
        "title": {"type": "string"},
        "maker": {"type": "string"},
        "date_label": {"type": "string"},
        "source_url": {"type": "string", "format": "uri"},
        "status": {"const": "placeholder_only"}
      }
    },
    "sources": {
      "type": "array",
      "minItems": 2,
      "items": {
        "type": "object",
        "required": ["label", "url", "type"],
        "properties": {
          "label": {"type": "string", "minLength": 1},
          "url": {"type": "string", "format": "uri"},
          "type": {"enum": ["liturgical_calendar", "vatican", "encyclopedia", "academic", "news", "devotional"]}
        }
      }
    },
    "app_hooks": {
      "type": "object",
      "required": ["hero_line_en", "hero_line_vi", "prayer_prompt_en", "prayer_prompt_vi"],
      "properties": {
        "hero_line_en": {"type": "string", "minLength": 1},
        "hero_line_vi": {"type": "string", "minLength": 1},
        "prayer_prompt_en": {"type": "string", "minLength": 1},
        "prayer_prompt_vi": {"type": "string", "minLength": 1}
      }
    }
  }
}