{
  "id": "anno-2026-02-10",
  "date": "2026-02-10",
  "weekday": "Tuesday",
  "mock_priority": "engine_b_v1",
  "liturgical": {
    "rank": "Memorial",
    "color": "white",
    "title_en": "Memorial of Saint Scholastica, Virgin",
    "title_vi": "Lễ Nhớ Thánh Scholastica, Trinh Nữ"
  },
  "calendars": {
    "julian": "2026-01-28",
    "hebrew": "23 Shvat 5786",
    "islamic_umm_al_qura": "22 Sha'ban 1447 AH",
    "coptic": "3 Meshir 1742",
    "ethiopian": "3 Yekatit 2018"
  },
  "primary": {
    "type": "saint",
    "title_en": "Memorial of Saint Scholastica, Virgin",
    "title_vi": "Lễ Nhớ Thánh Scholastica, Trinh Nữ",
    "summary_en": "The Memorial of Saint Scholastica, Virgin calls the faithful to imitate the virtues of this holy witness. Monte Cassino, Italy marks the geographical heart of their earthly pilgrimage and the foundation of their spiritual legacy.",
    "summary_vi": "Lễ Nhớ Thánh Scholastica, Trinh Nữ mời gọi các tín hữu noi gương các nhân đức của vị chứng nhân thánh thiện này. Monte Cassino, Italy đánh dấu trung tâm địa lý của cuộc hành hương trần thế và nền tảng di sản thiêng liêng của ngài.",
    "body_en": "Saint Scholastica offers a powerful witness of Christian discipleship. Through prayer, sacrifice, and unwavering faith, this saint shows the path to holiness that is open to all the baptized. The Church commemorates this holy witness on 2026-02-10, inviting the faithful to seek their intercession and emulate their virtues. The geography of their ministry — particularly Monte Cassino, Italy — remains a place of pilgrimage and prayer for those seeking to follow in their footsteps.",
    "body_vi": "Thánh Scholastica là chứng nhân mạnh mẽ cho sự môn đệ Kitô giáo. Qua cầu nguyện, hy sinh và đức tin kiên vững, vị thánh này chỉ ra con đường nên thánh mở ra cho mọi người đã chịu phép rửa. Giáo Hội tưởng nhớ vị chứng nhân thánh thiện này vào ngày 2026-02-10, mời gọi các tín hữu tìm kiếm sự chuyển cầu của ngài và noi gương các nhân đức. Địa điểm của sứ vụ ngài — đặc biệt là Monte Cassino, Italy — vẫn là nơi hành hương và cầu nguyện cho những ai muốn bước theo dấu chân ngài.",
    "confidence": "confirmed",
    "confidence_note_en": "Liturgical day verified in the General Roman Calendar for 2026-02-10.",
    "confidence_note_vi": "Ngày phụng vụ được xác nhận trong Lịch Chung Rôma cho ngày 2026-02-10."
  },
  "place": {
    "name": "Monte Cassino, Italy",
    "latitude": null,
    "longitude": null,
    "confidence": "traditional",
    "source_url": "https://www.catholic.org/saints/"
  },
  "artwork": {
    "title": "Saint Scholastica, Virgin",
    "maker": "Sacred Art",
    "date_label": "Historical",
    "source_url": "https://commons.wikimedia.org/wiki/Saints",
    "status": "placeholder_only"
  },
  "sources": [
    {
      "label": "USCCB Liturgical Calendar",
      "url": "https://bible.usccb.org/daily-bible-reading",
      "type": "liturgical_calendar"
    },
    {
      "label": "Catholic Encyclopedia — Saint Index",
      "url": "https://www.newadvent.org/cathen/",
      "type": "encyclopedia"
    }
  ],
  "app_hooks": {
    "hero_line_en": "Honoring the life and witness of Saint Scholastica, Virgin",
    "hero_line_vi": "Tôn vinh cuộc đời và chứng tá của Thánh Scholastica, Trinh Nữ",
    "prayer_prompt_en": "Lord, through the intercession of Saint Scholastica, Virgin, grant us the grace to follow Christ more faithfully in our daily lives.",
    "prayer_prompt_vi": "Lạy Chúa, nhờ sự chuyển cầu của Thánh Scholastica, Trinh Nữ, xin ban cho chúng con ân sủng trung thành hơn với Đức Kitô trong cuộc sống hàng ngày."
  }
}